,Date,Title,Source,URL,Section
727,2023-06-14 09:56:00,"Movers & Shakers: Tesla shares rise, as Logitech, Kura and UnitedHealth fall and other stocks on the move",MarketWatch,https://www.marketwatch.com/story/tesla-shares-rise-as-logitech-kura-and-unitedhealth-fall-and-other-stocks-on-the-move-aaae4d,general
728,2023-06-14 09:56:00,HSBC Bank Plc - Form 8.5 (EPT/RI) - Civitas Social Housing PLC,GlobalNewswire,https://www.globenewswire.com/news-release/2023/06/14/2687857/0/en/HSBC-Bank-Plc-Form-8-5-EPT-RI-Civitas-Social-Housing-PLC.html,merger
729,2023-06-14 09:41:55,Fed Preview: Bitcoin Market Skews Bearish as Analysts Anticipate 'Hawkish Rate-Hike Pause',CoinDesk,https://www.coindesk.com/markets/2023/06/14/fed-preview-bitcoin-market-skewed-bearish-as-analysts-anticipate-hawkish-rate-hike-pause/?utm_medium=referral&utm_source=rss&utm_campaign=headlines,crypto
730,2023-06-14 09:39:58,AMD reveals new AI chip challenging Nvidia's dominance,Cointelegraph,https://cointelegraph.com/news/amd-reveals-new-a-i-chip-challenging-nvidia-s-dominance,crypto
731,2023-06-14 09:31:00,"Dow Jones Newswires: Shell to lift dividend by 15%, launch $5 billion buyback",MarketWatch,https://www.marketwatch.com/story/shell-to-lift-dividend-by-15-launch-5-billion-buyback-2nd-update-6e901165,general
732,2023-06-14 09:30:12,"Outlook on FTSE 100, DAX 40 and S&P 500 ahead of Wednesday’s FOMC meeting.",Dailyfx,https://www.dailyfx.com/news/outlook-on-ftse-100-dax-40-and-s-p-500-ahead-of-wednesday-s-fomc-meeting-20230614.html,forex
733,2023-06-14 09:13:01,USDCHF Technical Analysis,Forexlive,https://www.forexlive.com/technical-analysis/usdchf-technical-analysis-20230614/,forex
734,2023-06-14 09:12:10,Ripple welcomes MiCA regulation as US lawsuit highlights lack of clarity,Cointelegraph,https://cointelegraph.com/news/ripple-welcomes-europe-mica-regulation,crypto
735,2023-06-14 09:12:00,"Dow Jones Newswires: Oil demand to peak this decade as electric-vehicle uptake accelerates, IEA says",MarketWatch,https://www.marketwatch.com/story/oil-demand-to-peak-this-decade-as-electric-vehicle-uptake-accelerates-iea-says-447f2891,general
736,2023-06-14 09:03:00,NerdWallet: 5 tips to help your small business become a TikTok sensation,MarketWatch,https://www.marketwatch.com/story/5-tips-to-help-your-small-business-become-a-tiktok-sensation-44edb73f,general
737,2023-06-14 09:02:00,Kelley Blue Book: Volvo’s new electric EX30 offers exceptional safety and power—and the price is a bargain among EVs,MarketWatch,https://www.marketwatch.com/story/volvos-new-electric-ex30-offers-exceptional-safety-and-powerand-the-price-is-a-bargain-among-evs-2d935a6,general
738,2023-06-14 09:01:00,NerdWallet: How to declutter your finances,MarketWatch,https://www.marketwatch.com/story/how-to-declutter-your-finances-4283916f,general
739,2023-06-14 09:00:00,Next Avenue: Apps for all? Why some older people are locked out by digital ageism.,MarketWatch,https://www.marketwatch.com/story/apps-for-all-why-some-older-people-are-locked-out-by-digital-ageism-79c5607c,general
740,2023-06-14 09:00:00,"The Moneyist: ‘They’ve stopped all communication’: My brother and sister insist their 8 kids deserve a share of our late mother’s $440,000 estate",MarketWatch,https://www.marketwatch.com/story/theyve-stopped-all-communication-my-brother-and-sister-insist-their-8-kids-deserve-a-share-of-our-late-mothers-440-000-estate-42ea080b,general
741,2023-06-14 08:56:34,EUR/USD bound by 100-day moving average ahead of Fed policy decision,Forexlive,https://www.forexlive.com/news/eurusd-bound-by-100-day-moving-average-ahead-of-fed-policy-decision-20230614/,forex
742,2023-06-14 08:48:55,Bankrupt Crypto Exchange Bittrex U.S. Set to Allow Withdrawals Starting Thursday,CoinDesk,https://www.coindesk.com/policy/2023/06/14/bankrupt-crypto-exchange-bittrex-us-set-to-allow-withdrawals-starting-thursday/?utm_medium=referral&utm_source=rss&utm_campaign=headlines,crypto
743,2023-06-14 08:38:00,Form 8.5 (EPT/RI) - FireAngel Safety Technology Group Plc,GlobalNewswire,https://www.globenewswire.com/news-release/2023/06/14/2687825/0/en/Form-8-5-EPT-RI-FireAngel-Safety-Technology-Group-Plc.html,merger
744,2023-06-14 08:36:00,Form 8.5 (EPT/RI) - Sureserve Group Plc,GlobalNewswire,https://www.globenewswire.com/news-release/2023/06/14/2687824/0/en/Form-8-5-EPT-RI-Sureserve-Group-Plc.html,merger
745,2023-06-14 08:34:00,": Battered Bud Light parent Anheuser Busch InBev is a ‘nerve-racking’ buying opportunity, say analysts",MarketWatch,https://www.marketwatch.com/story/battered-bud-light-parent-anheuser-busch-inbev-is-a-nerve-racking-buying-opportunity-say-analysts-33b60737,general
746,2023-06-14 08:33:00,Market Snapshot: S&P 500 futures at fresh highs ahead of Fed decision,MarketWatch,https://www.marketwatch.com/story/s-p-500-futures-at-fresh-highs-ahead-of-fed-decision-1ff690ed,general
747,2023-06-14 08:28:00,Rule 8.3 - Medica Group Plc,GlobalNewswire,https://www.globenewswire.com/news-release/2023/06/14/2687818/0/en/Rule-8-3-Medica-Group-Plc.html,merger
748,2023-06-14 08:12:54,USDJPY Technical Analysis,Forexlive,https://www.forexlive.com/technical-analysis/usdjpy-technical-analysis-20230614/,forex
749,2023-06-14 07:52:00,: Seniors are finally catching up on delayed surgeries. That’s bad news for health insurers.,MarketWatch,https://www.marketwatch.com/story/seniors-are-finally-catching-up-on-delayed-surgeries-thats-bad-news-for-health-insurers-5faee42f,general
750,2023-06-14 07:50:42,"Resilient UK GDP Report Keeps Pound Afloat, Gilt Yields in Focus",Dailyfx,https://www.dailyfx.com/news/forex-resilient-uk-gdp-report-keeps-pound-afloat-gilt-yields-in-focus-wv-20230614.html,forex
751,2023-06-14 07:43:00,AI startup by ex-Meta and Google researchers raises $113M in seed funding,Cointelegraph,https://cointelegraph.com/news/ai-startup-by-ex-meta-and-google-researchers-raises-113m-in-seed-funding,crypto
752,2023-06-14 07:17:25,WTI Crude Oil Technical Analysis,Forexlive,https://www.forexlive.com/technical-analysis/wti-crude-oil-technical-analysis-20230614/,forex
753,2023-06-14 07:12:00,Adhesives and Sealants Market to Touch USD 92.29 Billion by 2029 | Exhibiting a CAGR of 5%,GlobalNewswire,https://www.globenewswire.com/news-release/2023/06/14/2687805/0/en/Adhesives-and-Sealants-Market-to-Touch-USD-92-29-Billion-by-2029-Exhibiting-a-CAGR-of-5.html,merger
754,2023-06-14 07:09:00,Shrimp Market Size to Worth USD 53.63 Billion by 2028 | At a CAGR of 6.81%,GlobalNewswire,https://www.globenewswire.com/news-release/2023/06/14/2687803/0/en/Shrimp-Market-Size-to-Worth-USD-53-63-Billion-by-2028-At-a-CAGR-of-6-81.html,merger
755,2023-06-14 07:05:00,Protective Face Mask Industry Anticipated to Hit $19.85 Billion by 2029 | Fortune Business Insights™,GlobalNewswire,https://www.globenewswire.com/news-release/2023/06/14/2687801/0/en/Protective-Face-Mask-Industry-Anticipated-to-Hit-19-85-Billion-by-2029-Fortune-Business-Insights.html,merger
756,2023-06-14 07:02:00,"Graphene Market to Reach USD 2,172.2 Million by 2029 | Exhibiting a CAGR of 30.5%",GlobalNewswire,https://www.globenewswire.com/news-release/2023/06/14/2687799/0/en/Graphene-Market-to-Reach-USD-2-172-2-Million-by-2029-Exhibiting-a-CAGR-of-30-5.html,merger
757,2023-06-14 06:58:00,Aviation MRO Software Market to Worth USD 9.76 Billion by 2029 | With a 4.93% CAGR,GlobalNewswire,https://www.globenewswire.com/news-release/2023/06/14/2687790/0/en/Aviation-MRO-Software-Market-to-Worth-USD-9-76-Billion-by-2029-With-a-4-93-CAGR.html,merger
758,2023-06-14 06:57:00,"CBD Oil Market to Reach USD 55,791.3 Million by 2028 | With a CAGR of 47.49%",GlobalNewswire,https://www.globenewswire.com/news-release/2023/06/14/2687789/0/en/CBD-Oil-Market-to-Reach-USD-55-791-3-Million-by-2028-With-a-CAGR-of-47-49.html,merger
759,2023-06-14 06:49:00,"With 5.77% CAGR, Agricultural Adjuvants Market to Reach USD 4.55 Billion by 2028",GlobalNewswire,https://www.globenewswire.com/news-release/2023/06/14/2687788/0/en/With-5-77-CAGR-Agricultural-Adjuvants-Market-to-Reach-USD-4-55-Billion-by-2028.html,merger
760,2023-06-14 06:31:34,Crypto industry 'destined' to be BTC-focused due to regulators: Michael Saylor,Cointelegraph,https://cointelegraph.com/news/industry-will-focus-on-bitcoin-due-to-regulators-michael-saylor,crypto
761,2023-06-14 06:25:08,Binance CEO Hits Back at Rumors of Exchange Selling Bitcoin For BNB Coin,CoinDesk,https://www.coindesk.com/markets/2023/06/14/binance-ceo-hits-back-at-rumors-of-exchange-selling-bitcoin-for-bnb-coin/?utm_medium=referral&utm_source=rss&utm_campaign=headlines,crypto
762,2023-06-14 06:07:17,Eurostoxx futures -0.1% in early European trading,Forexlive,https://www.forexlive.com/news/eurostoxx-futures-01-in-early-european-trading-20230614/,forex
763,2023-06-14 06:00:00,Euro Gains as the US Dollar Frets ahead of the Fed after Benign CPI. Higher EUR/USD?,Dailyfx,https://www.dailyfx.com/news/euro-gains-as-the-us-dollar-frets-ahead-of-the-fed-after-benign-cpi-higher-eur-usd-20230614.html,forex
764,2023-06-14 05:54:24,"AWS went down in the US, but Ethereum kept humming",Cointelegraph,https://cointelegraph.com/news/aws-went-down-but-ethereum-stayed-up,crypto
765,2023-06-14 05:07:48,A couple of releases to move things along in Europe today,Forexlive,https://www.forexlive.com/news/a-couple-of-releases-to-move-things-along-in-europe-today-20230614/,forex
766,2023-06-14 05:00:00,Elis pursues its development in the Italian Pest Control market with the acquisition of Gruppo Indaco,GlobalNewswire,https://www.globenewswire.com/news-release/2023/06/14/2687761/0/en/Elis-pursues-its-development-in-the-Italian-Pest-Control-market-with-the-acquisition-of-Gruppo-Indaco.html,merger
767,2023-06-14 05:00:00,Elis poursuit son développement sur le marché du Pest Control en Italie avec l’acquisition de Gruppo Indaco,GlobalNewswire,https://www.globenewswire.com/news-release/2023/06/14/2687761/0/fr/Elis-poursuit-son-d%C3%A9veloppement-sur-le-march%C3%A9-du-Pest-Control-en-Italie-avec-l-acquisition-de-Gruppo-Indaco.html,merger
768,2023-06-14 04:30:56,Welcome to Fed day,Forexlive,https://www.forexlive.com/news/welcome-to-fed-day-20230614/,forex
769,2023-06-14 04:12:06,Privacy should be considered in ‘potential retail CBDC’ — Treasury official,Cointelegraph,https://cointelegraph.com/news/privacy-anonymity-considered-retail-cbdc-treasury,crypto
770,2023-06-14 03:35:56,Ripple’s Alderoty calls for probe into Bill Hinman and his infamous speech,Cointelegraph,https://cointelegraph.com/news/ripple-alderoty-probe-sec-william-hinman-speech,crypto
771,2023-06-14 03:30:00,Fertilizer Market: Helping Plants Thrive Since Forever,GlobalNewswire,https://www.globenewswire.com/news-release/2023/06/14/2687752/0/en/Fertilizer-Market-Helping-Plants-Thrive-Since-Forever.html,merger
772,2023-06-14 03:24:00,Citadel's Ken Griffin optimistic on growth in China,Forexlive,https://www.forexlive.com/news/citadels-ken-griffin-optimistic-on-growth-in-china-20230614/,forex
773,2023-06-14 03:12:00,: Tesla again raises starting price of Model Y by $250 in U.S.,MarketWatch,https://www.marketwatch.com/story/tesla-again-raises-starting-price-of-model-y-by-250-in-u-s-6915fa1f,general
774,2023-06-14 03:00:00,"Cooling US inflation provides room for Fed’s wait-and-see: Silver, Hang Seng Index, GBP/USD",Dailyfx,https://www.dailyfx.com/news/cooling-us-inflation-provides-room-for-fed-s-wait-and-see-silver-hang-seng-index-gbp-usd-20230614.html,forex
775,2023-06-14 02:42:12,Japan  Prime Minister Kishida considering dissolving lower house of parliament,Forexlive,https://www.forexlive.com/news/japan-prime-minister-kishida-considering-dissolving-lower-house-of-parliament-20230614/,forex
776,2023-06-14 02:40:11,SEC and Binance.US to negotiate deal avoiding total asset freeze,Cointelegraph,https://cointelegraph.com/news/sec-binance-us-negotiate-deal-asset-freeze,crypto
777,2023-06-14 02:30:00,Industrial Pumps to Witness Significant Adoption in the global market,GlobalNewswire,https://www.globenewswire.com/news-release/2023/06/14/2687742/0/en/Industrial-Pumps-to-Witness-Significant-Adoption-in-the-global-market.html,merger
778,2023-06-14 02:26:51,"China cut the retail prices of gasoline and diesel from Wednesday, the 6th cut this year",Forexlive,https://www.forexlive.com/news/china-cut-the-retail-prices-of-gasoline-and-diesel-from-wednesday-the-6th-cut-this-year-20230614/,forex
779,2023-06-14 01:52:00,Dow Jones Newswires: Toyota shares rise to 16-month high after next-generation BEV plan,MarketWatch,https://www.marketwatch.com/story/toyota-motor-shares-rise-to-16-month-high-after-next-generation-bev-plan-f5fb615a,general
780,2023-06-14 01:45:49,Binance CEO Changpeng Zhao denies rumors of selling Bitcoin to bolster BNB,Cointelegraph,https://cointelegraph.com/news/binance-ceo-changpeng-zhao-denies-rumors-selling-bitcoin-to-bolster-bnb,crypto
781,2023-06-14 01:30:00,Digitizing Healthcare: An In-Depth Analysis of the Global Electronic Medical Record Market,GlobalNewswire,https://www.globenewswire.com/news-release/2023/06/14/2687735/0/en/Digitizing-Healthcare-An-In-Depth-Analysis-of-the-Global-Electronic-Medical-Record-Market.html,merger
782,2023-06-14 01:25:05,US judge temporarily blocks Microsoft from completing Activision deal,SeekingAlpha,https://seekingalpha.com/news/3979691-us-judge-temporarily-blocks-microsoft-from-completing-activision-deal?utm_source=feed_news_m_a&utm_medium=referral,merger
783,2023-06-14 01:16:00,: Judge temporarily blocks Microsoft’s $69 billion purchase of Activision,MarketWatch,https://www.marketwatch.com/story/judge-temporarily-blocks-microsofts-69-billion-purchase-of-activision-b2e5d913,general
784,2023-06-14 01:00:00,Gold Price Peels Lower Despite Soft US Dollar Ahead of the Fed. Lower XAU/USD?,Dailyfx,https://www.dailyfx.com/news/gold-price-peels-lower-despite-soft-us-dollar-ahead-of-the-fed-lower-xau-usd-20230614.html,forex
785,2023-06-14 00:50:11,SEC asks for more time to respond to Coinbase call for crypto clarity,Cointelegraph,https://cointelegraph.com/news/sec-120-days-respond-coinbase-crypto-clarity,crypto
786,2023-06-14 00:44:28,"First Mover Asia: Actually, Hong Kong Would Be a Terrible Home for Coinbase",CoinDesk,https://www.coindesk.com/markets/2023/06/14/first-mover-asia-actually-hong-kong-would-be-a-terrible-home-for-coinbase/?utm_medium=referral&utm_source=rss&utm_campaign=headlines,crypto
787,2023-06-14 00:18:00,": Bud Light dethroned as top-selling beer by Modelo, as boycott cuts into sales",MarketWatch,https://www.marketwatch.com/story/bud-light-dethroned-as-top-selling-beer-by-modelo-as-boycott-cuts-into-sales-9ac9c240,general
788,2023-06-14 00:00:56,New Zealand FPI (May) +0.3% m/m (expected +0.3%),Forexlive,https://www.forexlive.com/news/new-zealand-fpi-may-03-mm-expected-03-20230614/,forex
789,2023-06-13 23:36:41,Australian weekly consumer confidence survey 72.7 (prior 77.7),Forexlive,https://www.forexlive.com/news/australian-weekly-consumer-confidence-survey-727-prior-777-20230613/,forex
790,2023-06-13 23:29:38,Cybernetic organizations — BORGs — are doomed to fail,Cointelegraph,https://cointelegraph.com/news/cybernetic-organizations-borgs-doomed-fail,crypto
791,2023-06-13 23:25:00,": How opera workers’ ruling could help Uber, Lyft and DoorDash workers unionize",MarketWatch,https://www.marketwatch.com/story/how-opera-workers-ruling-could-help-uber-lyft-and-doordash-workers-unionize-a3e1bb69,general
792,2023-06-13 23:22:00,BCUC Completes its Inquiry into the Acquisition of Renewable Natural Gas,GlobalNewswire,https://www.globenewswire.com/news-release/2023/06/13/2687723/0/en/BCUC-Completes-its-Inquiry-into-the-Acquisition-of-Renewable-Natural-Gas.html,merger
793,2023-06-13 23:20:54,"As the market rallies outside of tech and inflation cools, Cramer says it may be too late for some to get in on the action",CNBC,https://www.cnbc.com/2023/06/13/jim-cramer-says-it-may-be-too-late-for-some-to-get-in-on-the-action.html,general
794,2023-06-13 23:20:19,SEC Says It May Make a Recommendation on Coinbase Petition Within 4 Months,CoinDesk,https://www.coindesk.com/policy/2023/06/13/sec-says-it-may-make-a-recommendation-on-coinbase-petition-within-4-months/?utm_medium=referral&utm_source=rss&utm_campaign=headlines,crypto
795,2023-06-13 23:06:00,: Manchester United shares jump on report Qatar’s Sheikh Jassim to be named preferred bidder,MarketWatch,https://www.marketwatch.com/story/manchester-united-shares-leap-on-report-qatari-suitor-to-be-named-preferred-bidder-33d9f372,general
796,2023-06-13 23:03:00,: ‘Wheel of Fortune’ host Pat Sajak is retiring after 40 years. Why you shouldn’t stay at a job that long – and why you should.,MarketWatch,https://www.marketwatch.com/story/wheel-of-fortune-host-pat-sajak-is-retiring-after-40-years-why-you-shouldnt-stay-at-a-job-that-long-and-why-you-should-badcba7b,general
797,2023-06-13 22:50:53,"New Zealand data, Q1 Current Account deficit",Forexlive,https://www.forexlive.com/news/new-zealand-data-q1-current-account-deficit-20230613/,forex
798,2023-06-13 22:50:00,Market Extra: Treasury-bond ETFs fall after inflation report as investors brace for Fed decision,MarketWatch,https://www.marketwatch.com/story/treasury-bond-etfs-fall-after-inflation-report-as-investors-brace-for-fed-decision-e712834a,general
799,2023-06-13 22:10:00,"FA Center: Before hiring a financial planner, catch them off-guard with smart questions that extract revealing answers",MarketWatch,https://www.marketwatch.com/story/before-hiring-a-financial-planner-catch-them-off-guard-withsmart-questions-thatextract-revealing-answers-d60b4d7,general
800,2023-06-13 22:06:56,Shareholders OK Hudbay acquisition of Copper Mountain Mining,SeekingAlpha,https://seekingalpha.com/news/3979683-shareholders-ok-hudbay-acquisition-of-copper-mountain-mining?utm_source=feed_news_m_a&utm_medium=referral,merger
801,2023-06-13 22:02:37,"LL Flooring gains as investor consortium pushes for sales process, talks with F9",SeekingAlpha,https://seekingalpha.com/news/3979685-ll-flooring-gains-as-investor-consortium-pushes-for-sales-process-talks-with-f9?utm_source=feed_news_m_a&utm_medium=referral,merger
802,2023-06-13 22:02:00,Personal Finance Daily: Should you be worried if your crypto is in Binance.US or Coinbase and missing even one student-loan payment can seriously hurt your credit score,MarketWatch,https://www.marketwatch.com/story/should-you-be-worried-if-your-crypto-is-in-binance-usor-coinbase-and-missing-even-one-student-loan-payment-can-seriously-hurt-your-credit-score-a3dd2b3,general
803,2023-06-13 21:58:00,": Starbucks denies union accusations, says it’s not banning Pride decorations in stores",MarketWatch,https://www.marketwatch.com/story/starbucks-denies-union-accusations-says-its-not-banning-pride-decorations-in-stores-b8e258ac,general
804,2023-06-13 21:42:32,"Illumina acquisition of Grail wins support from GOP lawmakers, state AGs as FTC tries to block",CNBC,https://www.cnbc.com/2023/06/13/illumina-grail-deal-wins-support-from-gop-lawmakers-ags.html,general
805,2023-06-13 21:41:17,North Korean hackers swipe over $100M from Atomic Wallet users,Cointelegraph,https://cointelegraph.com/news/north-korean-hackers-swipe-over-100m-from-atomic-wallet-users,crypto
806,2023-06-13 21:31:46,U.S. Judge Rebuffs SEC Request for Binance.US Asset Freeze for Now,CoinDesk,https://www.coindesk.com/policy/2023/06/13/us-judge-rebuffs-sec-request-for-binanceus-asset-freeze-for-now/?utm_medium=referral&utm_source=rss&utm_campaign=headlines,crypto
807,2023-06-13 21:25:14,"Disney delays Avatar, Marvel and Star Wars movies as it shuffles releases",CNBC,https://www.cnbc.com/2023/06/13/disney-delays-avatar-marvel-star-wars-movies.html,general
808,2023-06-13 21:19:00,": Nvidia officially closes in $1 trillion territory, becoming seventh U.S. company to hit market-cap milestone",MarketWatch,https://www.marketwatch.com/story/nvidia-officially-closes-in-1-trillion-territory-becoming-seventh-u-s-company-to-hit-market-cap-milestone-88ead8f9,general
809,2023-06-13 21:17:30,Forexlive Americas FX news wrap 13 Jun: US CPI comes tumbles to 4% in May,Forexlive,https://www.forexlive.com/news/forexlive-americas-fx-news-wrap-13-jun-us-cpi-comes-tumbles-to-4-in-may-20230613/,forex
810,2023-06-13 21:15:00,"Hinman documents suggest SEC is the wrong agency to govern digital assets, crypto lawyer says",Cointelegraph,https://cointelegraph.com/news/hinman-documents-suggest-sec-is-the-wrong-agency-to-govern-digital-assets-crypto-lawyer-says,crypto
811,2023-06-13 21:14:00,"In One Chart: U.S. stocks typically climb on Fed days, but the trend is weaker under Powell",MarketWatch,https://www.marketwatch.com/story/u-s-stocks-typically-climb-on-fed-days-but-the-trend-is-weaker-under-powell-f50b99eb,general
812,2023-06-13 21:11:00,Market Extra: Why Wall Street is still divided on 2023 stock-market outlook as S&P 500 enters new bull market,MarketWatch,https://www.marketwatch.com/story/why-wall-street-is-still-divided-on-2023-stock-market-outlook-as-s-p-500-enters-new-bull-market-82c2b42c,general
813,2023-06-13 21:00:00,"SEC hears from Blockchain Assoc., House Republicans on ‘exchange’ definition proposal",Cointelegraph,https://cointelegraph.com/news/sec-hears-from-blockchain-assoc-house-republicans-on-exchange-definition-proposal,crypto
814,2023-06-13 20:46:05,Apollo funds invest in ISO tank operator Intermodal,SeekingAlpha,https://seekingalpha.com/news/3979657-apollo-funds-invests-in-iso-tank-operator-intermodal?utm_source=feed_news_m_a&utm_medium=referral,merger
815,2023-06-13 20:39:07,Malacca Straits Acquisition to liquidate after ending deal with Indiev,SeekingAlpha,https://seekingalpha.com/news/3979653-malacca-straits-acquisition-to-liquidate-after-ending-deal-with-indiev?utm_source=feed_news_m_a&utm_medium=referral,merger
816,2023-06-13 20:35:00,Footwear conglomerate Puma launches 3D Web3 experience,Cointelegraph,https://cointelegraph.com/news/footwear-conglomerate-puma-launches-3d-web3-experience,crypto
817,2023-06-13 20:33:29,Private oil survey data shows headline crude oil build vs draw expected,Forexlive,https://www.forexlive.com/news/private-oil-survey-data-shows-headline-crude-oil-build-vs-draw-expected-20230613/,forex
818,2023-06-13 20:30:00,Apixio and ClaimLogiq Merge to Create a Leading Connected Care Platform,BusinessWire,http://www.businesswire.com/news/home/20230613707738/en/Apixio-and-ClaimLogiq-Merge-to-Create-a-Leading-Connected-Care-Platform/?feedref=JjAwJuNHiystnCoBq_hl-Rc4vIAVcHHkbDcwJimU8QtrtlakeQ9hNboBqTAWIjTge3KWq9s9jif-UkBjBsFRyYAbRTSLTc1mgvhPlnaBA55M-oupQnbXnhKsYk8RmHF_kAy2gZikaX3QWV6xOvgFlA==,merger
819,2023-06-13 20:18:51,The close: The value trade leads the way as US stocks hit new highs,Forexlive,https://www.forexlive.com/news/the-close-the-value-trade-leads-the-way-as-us-stocks-hit-new-highs-20230613/,forex
820,2023-06-13 20:16:06,"SBF seeks to sever new charges from trial, says proceedings may take 'years'",Cointelegraph,https://cointelegraph.com/news/sbf-seeks-to-sever-new-charges-from-trial-says-proceedings-may-take-years,crypto
821,2023-06-13 20:15:00,Treace Medical Completes Acquisition of Technology Enabling Patient Specific Instrumentation and Reports on Clinical Cases Using PSI with the Lapiplasty® System,GlobalNewswire,https://www.globenewswire.com/news-release/2023/06/13/2687659/0/en/Treace-Medical-Completes-Acquisition-of-Technology-Enabling-Patient-Specific-Instrumentation-and-Reports-on-Clinical-Cases-Using-PSI-with-the-Lapiplasty-System.html,merger
822,2023-06-13 20:10:20,"Starwood Capital considers selling more than 2,000 single-family rental homes - report",SeekingAlpha,https://seekingalpha.com/news/3979636-starwood-capital-considers-selling-more-than-2000-single-family-rental-homes-report?utm_source=feed_news_m_a&utm_medium=referral,merger
823,2023-06-13 20:10:00,"US Dollar Drips Lower Ahead of Key Fed Decision, Levels to Watch on DXY",Dailyfx,https://www.dailyfx.com/news/forex-us-dollar-drips-lower-ahead-of-key-fed-decision-levels-to-watch-on-dxy-20230613.html,forex
824,2023-06-13 19:59:57,US lawmaker invokes SEC lawsuits in considering crypto regulatory framework,Cointelegraph,https://cointelegraph.com/news/us-lawmaker-invokes-sec-lawsuits-in-considering-crypto-regulatory-framework,crypto
825,2023-06-13 19:52:51,Ripple Does Not Care Whether XRP Is 'Sufficiently Decentralized',CoinDesk,https://www.coindesk.com/consensus-magazine/2023/06/13/ripple-does-not-care-whether-xrp-is-sufficiently-decentralized/?utm_medium=referral&utm_source=rss&utm_campaign=headlines,crypto
826,2023-06-13 19:46:04,Crude oil is higher on the day but still stays below the $70 level,Forexlive,https://www.forexlive.com/technical-analysis/crude-oil-is-higher-on-the-day-but-still-stays-below-the-70-level-20230613/,forex
827,2023-06-13 19:35:07,Fanatics holds second investor day as the company moves toward IPO,CNBC,https://www.cnbc.com/2023/06/13/fanatics-holds-second-investor-day-as-the-company-moves-toward-ipo.html,general
828,2023-06-13 19:32:22,Why Bitcoin’s resistance to retesting the $25K support could be futile,Cointelegraph,https://cointelegraph.com/news/why-bitcoin-resistance-to-retesting-25-k-support-is-futile,crypto
829,2023-06-13 19:22:31,USD/JPY is thinking about a break to the upside,Forexlive,https://www.forexlive.com/news/usdjpy-is-thinking-about-a-break-to-the-upside-20230613/,forex
830,2023-06-13 19:00:00,Irish data watchdog blocks Google from launching Bard in the EU: Report,Cointelegraph,https://cointelegraph.com/news/irish-data-watchdog-blocks-google-from-launching-bard-in-the-eu-report,crypto
831,2023-06-13 18:55:00,: Should you be worried if your crypto is in Binance.US or Coinbase?,MarketWatch,https://www.marketwatch.com/story/should-you-be-worried-if-your-crypto-is-in-binance-usor-coinbase-45794f76,general
832,2023-06-13 18:50:55,Big turn in the bond market points to higher inflation later,Forexlive,https://www.forexlive.com/news/big-turn-in-the-bond-market-points-to-higher-inflation-later-20230613/,forex
