,Date,Title,Source,URL,Section
412,2023-06-15 13:32:28,'It costs money to owe money': How to balance student loans and saving for retirement,CNBC,https://www.cnbc.com/2023/06/15/how-to-balance-paying-off-student-loans-and-saving-for-retirement.html,general
413,2023-06-15 13:31:33,China weighs Emerson's filing for National Instruments under simplified procedure -report,SeekingAlpha,https://seekingalpha.com/news/3980184-china-weighs-emersons-filing-for-national-instruments-under-simplified-procedure-report?utm_source=feed_news_m_a&utm_medium=referral,merger
414,2023-06-15 13:30:01,"If you make $75,000 or less, you probably can't afford to buy a home in these 12 cities",CNBC,https://www.cnbc.com/2023/06/15/if-you-make-75000-dollars-you-probably-cant-afford-a-home-in-these-cities.html,general
415,2023-06-15 13:30:00,Nanomaterials: The future of healthcare and electronics,GlobalNewswire,https://www.globenewswire.com/news-release/2023/06/15/2689001/0/en/Nanomaterials-The-future-of-healthcare-and-electronics.html,merger
416,2023-06-15 13:30:00,Opinion: GOP crypto maxis almost as bad as Dems’ ‘anti-crypto army’,Cointelegraph,https://cointelegraph.com/magazine/opinion-republican-crypto-maxis-democrat-anti-crypto-army-mchenry-warren/,crypto
417,2023-06-15 13:30:00,Economic Report: U.S. industrial output falls 0.2% in May after two straight gains,MarketWatch,https://www.marketwatch.com/story/u-s-industrial-output-falls-0-2-in-may-after-two-straight-gains-be60f7ab,general
418,2023-06-15 13:25:00,"CSC Acquires Eddystone Financial Services, Expanding Loan Agency Offering in Australasia",BusinessWire,http://www.businesswire.com/news/home/20230615592918/en/CSC-Acquires-Eddystone-Financial-Services-Expanding-Loan-Agency-Offering-in-Australasia/?feedref=JjAwJuNHiystnCoBq_hl-Rc4vIAVcHHkbDcwJimU8QtrtlakeQ9hNboBqTAWIjTge3KWq9s9jif-UkBjBsFRyYAbRTSLTc1mgvhPlnaBA55M-oupQnbXnhKsYk8RmHF_kAy2gZikaX3QWV6xOvg,merger
419,2023-06-15 13:15:30,US industrial production for May -0.2% versus 0.1% expected,Forexlive,https://www.forexlive.com/news/us-industrial-production-for-may-02-versus-01-expected-20230615/,forex
420,2023-06-15 13:05:00,MiddleGround Capital Acquires A.M. Castle & Co. Targeting Capital Raise for SPV,GlobalNewswire,https://www.globenewswire.com/news-release/2023/06/15/2688970/0/en/MiddleGround-Capital-Acquires-A-M-Castle-Co-Targeting-Capital-Raise-for-SPV.html,merger
421,2023-06-15 13:01:00,Economic Report: Import prices sink again to help ease U.S. inflation,MarketWatch,https://www.marketwatch.com/story/import-prices-sink-again-to-help-ease-u-s-inflation-bc641564,general
422,2023-06-15 13:00:04,Crypto Platforms Halt Withdrawals in Echo of Sector's 2022 Woes...,Bloomberg,https://www.bloomberg.com/news/articles/2023-06-14/delio-follows-haru-in-pausing-withdrawals-on-high-yield-crypto-platform,general
423,2023-06-15 13:00:01,Here’s how much money it takes to be considered wealthy in 13 major U.S. cities,CNBC,https://www.cnbc.com/2023/06/15/how-much-money-it-takes-to-be-considered-wealthy-in-major-us-cities.html,general
424,2023-06-15 13:00:00,FE International Advises Acquisition of Action at Work by Vertigo Studio,GlobalNewswire,https://www.globenewswire.com/news-release/2023/06/15/2688933/0/en/FE-International-Advises-Acquisition-of-Action-at-Work-by-Vertigo-Studio.html,merger
425,2023-06-15 13:00:00,"Revolutionizing Education, One Data Point at a Time",GlobalNewswire,https://www.globenewswire.com/news-release/2023/06/15/2688958/0/en/Revolutionizing-Education-One-Data-Point-at-a-Time.html,merger
426,2023-06-15 13:00:00,Here’s how hackers are using mining pools as mixers: Chainalysis,Cointelegraph,https://cointelegraph.com/news/hackers-use-mining-pools-as-mixers-chainalysis-report,crypto
427,2023-06-15 13:00:00,A PR expert’s tips for memecoin projects,Cointelegraph,https://cointelegraph.com/innovation-circle/a-pr-experts-tips-for-memecoin-projects,crypto
428,2023-06-15 12:55:00,The Ratings Game: SoFi’s stock set to snap record winning streak after downgrade,MarketWatch,https://www.marketwatch.com/story/sofis-stock-set-to-snap-record-winning-streak-after-downgrade-996cc13c,general
429,2023-06-15 12:50:22,Celsius seeks to convert alts to Bitcoin and Ether under reorganization plan,Cointelegraph,https://cointelegraph.com/news/celsius-seeks-to-convert-alts-to-bitcoin-and-ether-under-reorganization-plan,crypto
430,2023-06-15 12:49:00,Market Extra: European Central Bank lifts interest rates after Fed takes a pause,MarketWatch,https://www.marketwatch.com/story/european-central-bank-lifts-rates-after-fed-takes-a-pause-b383f8c8,general
431,2023-06-15 12:48:00,Economic Report: Retail sales rise again and point to resilience of the U.S. economy,MarketWatch,https://www.marketwatch.com/story/retail-sales-rise-again-and-point-to-resilience-of-the-u-s-economy-cb6325f2,general
432,2023-06-15 12:47:00,"Economic Report: New York Empire State, Philadelphia Fed factory indexes mixed but show signs of optimism",MarketWatch,https://www.marketwatch.com/story/ny-empire-state-philly-fed-factory-indexes-show-signs-of-optimism-e5c9b93e,general
433,2023-06-15 12:45:56,"EUR Breaking News: ECB hikes by 25bps, Euro Firms on Revised Inflation",Dailyfx,https://www.dailyfx.com/news/forex-eur-breaking-news-ecb-hikes-by-25bps-euro-firms-on-revised-inflation-wv-20230615.html,forex
434,2023-06-15 12:41:00,"Economic Report: Jobless claims stick near highest level in almost two years at 262,000",MarketWatch,https://www.marketwatch.com/story/jobless-claims-stick-near-highest-level-in-almost-two-years-at-262-000-2cdb08f5,general
435,2023-06-15 12:41:00,"Phillips 66 Completes Acquisition of DCP Midstream, LP Common Units",BusinessWire,http://www.businesswire.com/news/home/20230614491693/en/Phillips-66-Completes-Acquisition-of-DCP-Midstream-LP-Common-Units/?feedref=JjAwJuNHiystnCoBq_hl-Rc4vIAVcHHkbDcwJimU8QtrtlakeQ9hNboBqTAWIjTge3KWq9s9jif-UkBjBsFRyYAbRTSLTc1mgvhPlnaBA55M-oupQnbXnhKsYk8RmHF_kAy2gZikaX3QWV6xOvgFlA==,merger
436,2023-06-15 12:40:04,Canna-Global Acquisition to merge with fintech company New Quantum,SeekingAlpha,https://seekingalpha.com/news/3980142-canna-global-acquisition-to-merge-with-fintech-company-new-quantum?utm_source=feed_news_m_a&utm_medium=referral,merger
437,2023-06-15 12:30:57,US initial jobless claims for the current week 262K vs. 249K estimate,Forexlive,https://www.forexlive.com/news/us-initial-jobless-claims-for-the-current-week-262k-vs-249k-estimate-20230615/,forex
438,2023-06-15 12:30:01,"21-year-old flies 600 miles a week to avoid paying $3,500-a-month New York rent—here's how much she saves",CNBC,https://www.cnbc.com/2023/06/15/21-year-old-super-commutes-for-summer-internship-how-she-saves-money.html,general
439,2023-06-15 12:30:00,Wheeling and Dealing: The Competitive World of Automotive Rims,GlobalNewswire,https://www.globenewswire.com/news-release/2023/06/15/2688893/0/en/Wheeling-and-Dealing-The-Competitive-World-of-Automotive-Rims.html,merger
440,2023-06-15 12:28:00,Form 8.3 - LondonMetric Property PLC,GlobalNewswire,https://www.globenewswire.com/news-release/2023/06/15/2688878/0/en/Form-8-3-LondonMetric-Property-PLC.html,merger
441,2023-06-15 12:26:00,Mogil Organization Joins World Insurance LLC,GlobalNewswire,https://www.globenewswire.com/news-release/2023/06/15/2688877/0/en/Mogil-Organization-Joins-World-Insurance-LLC.html,merger
442,2023-06-15 12:23:00,Form 8.3 - Dechra Pharmaceuticals PLC,GlobalNewswire,https://www.globenewswire.com/news-release/2023/06/15/2688876/0/en/Form-8-3-Dechra-Pharmaceuticals-PLC.html,merger
443,2023-06-15 12:20:00,How blockchain technology makes it easier for Africans to upskill,Cointelegraph,https://cointelegraph.com/news/hashing-it-out-blockchain-africa-podcast-interview,crypto
444,2023-06-15 12:15:34,Canada May housing starts 202.5K vs 235.0K expected,Forexlive,https://www.forexlive.com/news/canada-may-housing-starts-2025k-vs-2350k-expected-20230615/,forex
445,2023-06-15 11:51:12,Trouble brews for gold,Forexlive,https://www.forexlive.com/news/trouble-brews-for-gold-20230615/,forex
446,2023-06-15 11:44:37,SMG Industries intends to acquire diversified transportation business in Northeastern U.S.,SeekingAlpha,https://seekingalpha.com/news/3980105-smg-industries-intends-to-acquire-diversified-transportation-business-in-northeastern-us?utm_source=feed_news_m_a&utm_medium=referral,merger
447,2023-06-15 11:32:01,A.I. will create winners and losers across the job market: Mark Zandi,CNBC,https://www.cnbc.com/2023/06/15/mark-zandi-says-ai-may-gradually-change-the-job-market.html,general
448,2023-06-15 11:30:00,Gold Prices Slide Again Thanks To Fed’s Hawkish Pause,Dailyfx,https://www.dailyfx.com/news/gold-prices-slide-again-thanks-to-fed-s-hawkish-pause-20230615.html,forex
449,2023-06-15 11:30:00,Earthstone Energy Announces $1.0 Billion Delaware Basin Acquisition,GlobalNewswire,https://www.globenewswire.com/news-release/2023/06/15/2688808/0/en/Earthstone-Energy-Announces-1-0-Billion-Delaware-Basin-Acquisition.html,merger
450,2023-06-15 11:30:00,NOG Announces Joint Acquisition of Northern Delaware Basin Permian Assets,BusinessWire,http://www.businesswire.com/news/home/20230614062931/en/NOG-Announces-Joint-Acquisition-of-Northern-Delaware-Basin-Permian-Assets/?feedref=JjAwJuNHiystnCoBq_hl-Rc4vIAVcHHkbDcwJimU8QtrtlakeQ9hNboBqTAWIjTge3KWq9s9jif-UkBjBsFRyYAbRTSLTc1mgvhPlnaBA55M-oupQnbXnhKsYk8RmHF_kAy2gZikaX3QWV6xOvgFlA==,merger
451,2023-06-15 11:17:00,Form 8.3 - FireAngel Safety Technology Group Plc,GlobalNewswire,https://www.globenewswire.com/news-release/2023/06/15/2688787/0/en/Form-8-3-FireAngel-Safety-Technology-Group-Plc.html,merger
452,2023-06-15 11:12:08,USDJPY Technical Analysis,Forexlive,https://www.forexlive.com/technical-analysis/usdjpy-technical-analysis-20230615/,forex
453,2023-06-15 11:00:01,Disney looks to get out of animation rut with Pixar's 'Elemental',CNBC,https://www.cnbc.com/2023/06/15/disney-looks-to-get-out-of-animation-rut-with-pixars-elemental.html,general
454,2023-06-15 10:35:00,Heart Sync: The Rise of Cardiac Resynchronization Therapy,GlobalNewswire,https://www.globenewswire.com/news-release/2023/06/15/2688726/0/en/Heart-Sync-The-Rise-of-Cardiac-Resynchronization-Therapy.html,merger
455,2023-06-15 10:31:14,North Korea has fired what could be a ballistic missile - Japan defence ministry,Forexlive,https://www.forexlive.com/news/north-korea-has-fired-what-could-be-a-ballistic-missile-japan-defence-ministry-20230615/,forex
456,2023-06-15 10:30:18,Macerich acquires remaining 50% interest in 5 former Sears boxes,SeekingAlpha,https://seekingalpha.com/news/3980066-macerich-acquires-remaining-50-interest-in-5-former-sears-boxes?utm_source=feed_news_m_a&utm_medium=referral,merger
457,2023-06-15 10:24:34,"Patterson-UTI Energy, NexTier to merge in all-stock deal",SeekingAlpha,https://seekingalpha.com/news/3980064-patterson-uti-energy-nextier-to-merge-in-all-stock-deal?utm_source=feed_news_m_a&utm_medium=referral,merger
458,2023-06-15 10:22:00,HSBC Bank Plc - Form 8.5 (EPT/RI) - Civitas Social Housing PLC,GlobalNewswire,https://www.globenewswire.com/news-release/2023/06/15/2688712/0/en/HSBC-Bank-Plc-Form-8-5-EPT-RI-Civitas-Social-Housing-PLC.html,merger
459,2023-06-15 10:15:00,"Help Me Retire: I’m 54 and the primary earner but ‘professionally, I am exhausted’ — we have $2.18 million but what about healthcare?",MarketWatch,https://www.marketwatch.com/story/im-54-and-the-primary-earner-but-professionally-i-am-exhausted-we-have-2-18-million-but-what-about-healthcare-3615fd9,general
460,2023-06-15 10:13:30,Bitcoin Halving History Provides Little Guidance on Outcome: Coinbase,CoinDesk,https://www.coindesk.com/markets/2023/06/15/bitcoin-halving-history-provides-little-guidance-on-outcome-coinbase/?utm_medium=referral&utm_source=rss&utm_campaign=headlines,crypto
461,2023-06-15 10:12:00,PHC Holdings Corporation的生命科學銷售和服務配銷子公司SciMed (Asia)成為獨資子公司 -- 收購擴大了PHC Group的業務，有助於為亞太地區研究人員和醫療機構提供支援 --,BusinessWire,http://www.businesswire.com/news/home/20230614735007/zh-HK/?feedref=JjAwJuNHiystnCoBq_hl-Rc4vIAVcHHkbDcwJimU8QtrtlakeQ9hNboBqTAWIjTge3KWq9s9jif-UkBjBsFRyYAbRTSLTc1mgvhPlnaBA55M-oupQnbXnhKsYk8RmHF_kAy2gZikaX3QWV6xOvgFlA==,merger
462,2023-06-15 10:07:00,Bond Report: Two-year Treasury yields at three-month highs after Fed points to more rate rises,MarketWatch,https://www.marketwatch.com/story/two-year-treasury-yields-at-three-month-highs-after-fed-points-to-more-rate-rises-2194b2d9,general
463,2023-06-15 10:06:00,": Minimum-wage workers would need to log 104 hours a week to reasonably afford a two-bedroom rental, report says",MarketWatch,https://www.marketwatch.com/story/minimum-wage-workers-would-need-to-log-104-hours-a-week-to-reasonably-afford-a-two-bedroom-rental-report-says-f4def2ed,general
464,2023-06-15 10:06:00,Form 8.3 - AXA INVESTMENT MANAGERS: LondonMetric Property Plc.,GlobalNewswire,https://www.globenewswire.com/news-release/2023/06/15/2688705/0/en/Form-8-3-AXA-INVESTMENT-MANAGERS-LondonMetric-Property-Plc.html,merger
465,2023-06-15 10:05:00,Gold Technical Analysis,Forexlive,https://www.forexlive.com/technical-analysis/gold-technical-analysis-20230615/,forex
466,2023-06-15 10:03:00,: Father knows best? What your parents’ generation got right and wrong on retirement.,MarketWatch,https://www.marketwatch.com/story/father-knows-best-what-your-parents-generation-got-right-and-wrong-on-retirement-697cefb6,general
467,2023-06-15 10:00:01,"Own it, don't trade it or book profits on a big winner? Cramer's Monthly Meeting advice is clear",CNBC,https://www.cnbc.com/2023/06/15/own-it-do-not-trade-it-or-book-profits-jim-cramer-advice-is-clear.html,general
468,2023-06-15 10:00:00,Macerich Acquires Remaining 50% Interest in 5 Former Sears Boxes from Seritage,GlobalNewswire,https://www.globenewswire.com/news-release/2023/06/15/2688697/0/en/Macerich-Acquires-Remaining-50-Interest-in-5-Former-Sears-Boxes-from-Seritage.html,merger
469,2023-06-15 10:00:00,Dow and CAC40 Drop Back from Weekly Highs but Nasdaq 100 Holds up Well,Dailyfx,https://www.dailyfx.com/news/dow-and-cac40-drop-back-from-weekly-highs-but-nasdaq-100-holds-up-well-20230615.html,forex
470,2023-06-15 10:00:00,ByBit plugs into ChatGPT for AI-powered trading tools,Cointelegraph,https://cointelegraph.com/news/bybit-plugs-into-chatgpt-for-ai-powered-trading-tools,crypto
471,2023-06-15 10:00:00,Exchanges pledged $2.5B to user protection funds amid FTX’s collapse: Report,Cointelegraph,https://cointelegraph.com/news/exchanges-pledged-2-5b-to-user-protection-funds-amid-ftx-s-collapse-report,crypto
472,2023-06-15 09:54:35,AUD/USD stays poised for a break higher towards the end of the week,Forexlive,https://www.forexlive.com/news/audusd-stays-poised-for-a-break-higher-towards-the-end-of-the-week-20230615/,forex
473,2023-06-15 09:47:00,": Powell says the Fed isn’t ‘going to an every other meeting kind of approach.’ That means it is, Fed watcher says",MarketWatch,https://www.marketwatch.com/story/powell-says-the-fed-isnt-going-to-an-every-other-meeting-kind-of-approach-that-means-it-is-fed-watcher-says-72408ba4,general
474,2023-06-15 09:40:22,"Curve pool imbalance triggers USDT depeg concerns, Tether CTO calls it FUD",Cointelegraph,https://cointelegraph.com/news/curve-pool-imbalance-usdt-depeg-concerns-tether-cto-calls-it-fud,crypto
475,2023-06-15 09:37:00,: Beyoncé shows up — in Sweden’s inflation data,MarketWatch,https://www.marketwatch.com/story/beyonce-shows-up-in-swedens-inflation-data-c164f34,general
476,2023-06-15 09:28:00,"Help My Career: ‘Make friends with this technology’: Yes, AI is coming for your job. Here’s how to prepare.",MarketWatch,https://www.marketwatch.com/story/make-friends-with-this-technology-yes-ai-is-coming-for-your-job-heres-how-to-prepare-b93c02d0,general
477,2023-06-15 09:20:59,Crypto trading bot borrows $200M for a $3 gain,Cointelegraph,https://cointelegraph.com/news/crypto-trading-bot-borrows-200m-for-a-3-gain,crypto
478,2023-06-15 09:07:22,Lesser UK businesses expected to raise prices in the month ahead - ONS,Forexlive,https://www.forexlive.com/news/lesser-uk-businesses-expected-to-raise-prices-in-the-month-ahead-ons-20230615/,forex
479,2023-06-15 09:03:00,Rule 8.3 - Medica Group Plc,GlobalNewswire,https://www.globenewswire.com/news-release/2023/06/15/2688672/0/en/Rule-8-3-Medica-Group-Plc.html,merger
480,2023-06-15 09:03:00,Livability: 5 cities where stuff is cheaper,MarketWatch,https://www.marketwatch.com/story/5-cities-where-stuff-is-cheaper-a23723fe,general
481,2023-06-15 09:02:00,"NerdWallet: For LGBTQ+ home buyers, finding the right real estate agent is critical",MarketWatch,https://www.marketwatch.com/story/for-lgbtq-home-buyers-finding-the-right-real-estate-agent-is-critical-48973979,general
482,2023-06-15 09:00:13,European Central Bank (ECB) Preview: Euro Bulls Look to ECB to Reignite Flame,Dailyfx,https://www.dailyfx.com/news/european-central-bank-ecb-preview-euro-bulls-look-to-ecb-to-reignite-flame-20230615.html,forex
483,2023-06-15 09:00:00,Next Avenue: Here’s one way to leave a lasting legacy in retirement,MarketWatch,https://www.marketwatch.com/story/heres-one-way-to-leave-a-lasting-legacy-in-retirement-6806c26e,general
484,2023-06-15 08:55:37,Here's what Nigeria's naira float means for its crypto market,Cointelegraph,https://cointelegraph.com/news/here-s-what-nigeria-s-naira-float-means-for-its-crypto-market,crypto
485,2023-06-15 08:48:50,Dow Jones Technical Analysis,Forexlive,https://www.forexlive.com/technical-analysis/dow-jones-technical-analysis-20230615/,forex
486,2023-06-15 08:44:00,Dimensional Fund Advisors Ltd. : Form 8.3 - Londonmetric Property PLC - Ordinary Shares,GlobalNewswire,https://www.globenewswire.com/news-release/2023/06/15/2688663/0/en/Dimensional-Fund-Advisors-Ltd-Form-8-3-Londonmetric-Property-PLC-Ordinary-Shares.html,merger
487,2023-06-15 08:43:00,Dimensional Fund Advisors Ltd. : Form 8.3 - CT PROPERTY TRUST LTD - Ordinary Shares,GlobalNewswire,https://www.globenewswire.com/news-release/2023/06/15/2688661/0/en/Dimensional-Fund-Advisors-Ltd-Form-8-3-CT-PROPERTY-TRUST-LTD-Ordinary-Shares.html,merger
488,2023-06-15 08:41:00,Dimensional Fund Advisors Ltd. : Form 8.3 - CIVITAS SOCIAL HOUSING PLC - Ordinary Shares,GlobalNewswire,https://www.globenewswire.com/news-release/2023/06/15/2688660/0/en/Dimensional-Fund-Advisors-Ltd-Form-8-3-CIVITAS-SOCIAL-HOUSING-PLC-Ordinary-Shares.html,merger
489,2023-06-15 08:35:00,Market Snapshot: U.S. stock futures stall as traders absorb Fed’s ‘hawkish pause’,MarketWatch,https://www.marketwatch.com/story/u-s-stock-futures-stall-as-traders-absorb-feds-hawkish-pause-69b8e007,general
490,2023-06-15 08:26:55,Fed to deliver one more 25 bps rate hike at July meeting - JP Morgan,Forexlive,https://www.forexlive.com/news/fed-to-deliver-one-more-25-bps-rate-hike-at-july-meeting-jp-morgan-20230615/,forex
491,2023-06-15 08:26:54,"XRP, ADA Lead Declines in Major Cryptocurrencies as Bitcoin Drops Below $25K",CoinDesk,https://www.coindesk.com/markets/2023/06/15/xrp-ada-lead-declines-in-major-cryptocurrencies-as-bitcoin-drops-below-25k/?utm_medium=referral&utm_source=rss&utm_campaign=headlines,crypto
492,2023-06-15 08:09:00,Form 8.5 (EPT/RI) - Sureserve Group Plc,GlobalNewswire,https://www.globenewswire.com/news-release/2023/06/15/2688642/0/en/Form-8-5-EPT-RI-Sureserve-Group-Plc.html,merger
493,2023-06-15 08:06:00,Form 8.5 (EPT/RI) - FireAngel Safety Technology Group Plc,GlobalNewswire,https://www.globenewswire.com/news-release/2023/06/15/2688639/0/en/Form-8-5-EPT-RI-FireAngel-Safety-Technology-Group-Plc.html,merger
494,2023-06-15 07:57:58,Crude Oil Prices Stifled by Chinese Economic Data & Stronger USD,Dailyfx,https://www.dailyfx.com/news/forex-crude-oil-prices-stifled-by-chinese-economic-data-stronger-usd-wv-20230615.html,forex
495,2023-06-15 07:46:10,US prosecutors say SBF will be tried on original 8 criminal charges — for now,Cointelegraph,https://cointelegraph.com/news/us-prosecutors-say-sbf-will-be-tried-on-original-8-criminal-charges-for-now,crypto
496,2023-06-15 07:35:29,Unilever to acquire frozen yogurt brand Yasso,SeekingAlpha,https://seekingalpha.com/news/3980013-unilever-agrees-to-acquire-colorado-based-frozen-yogurt-brand-yasso?utm_source=feed_news_m_a&utm_medium=referral,merger
497,2023-06-15 07:24:09,Russell 2000 Technical Analysis,Forexlive,https://www.forexlive.com/technical-analysis/russell-2000-technical-analysis-20230615/,forex
498,2023-06-15 06:57:41,‘Pick your targets’ — Bitcoin analyst believes Fed will favor bulls,Cointelegraph,https://cointelegraph.com/news/bitcoin-analyst-believes-fed-will-favor-bulls,crypto
499,2023-06-15 06:54:00,ENT Devices Market Size to Grow Higher by 2030,GlobalNewswire,https://www.globenewswire.com/news-release/2023/06/15/2688615/0/en/ENT-Devices-Market-Size-to-Grow-Higher-by-2030.html,merger
500,2023-06-15 06:50:57,S&P 500 Technical Analysis,Forexlive,https://www.forexlive.com/technical-analysis/sp-500-technical-analysis-20230615/,forex
501,2023-06-15 06:32:23,Binance launches Bitcoin mining cloud services amid SEC crackdown in the US,Cointelegraph,https://cointelegraph.com/news/binance-launches-bitcoin-mining-cloud-services-amid-sec-crackdown-in-the-us,crypto
502,2023-06-15 06:30:00,Bitcoin & Ethereum Slide as Fed Signals Higher Rates: BTC/USD & ETH/USD Price Setups,Dailyfx,https://www.dailyfx.com/news/bitcoin-ethereum-slide-as-fed-signals-higher-rates-btc-usd-eth-usd-price-setups-20230615.html,forex
503,2023-06-15 06:14:54,Eurostoxx futures -0.2% in early European trading,Forexlive,https://www.forexlive.com/news/eurostoxx-futures-02-in-early-european-trading-20230615/,forex
504,2023-06-15 06:04:05,3AC Seeks Contempt of Court Ruling on Founder Kyle Davies For Failing to Respond,CoinDesk,https://www.coindesk.com/policy/2023/06/15/3ac-seeks-contempt-of-court-ruling-on-founder-kyle-davies-for-failing-to-respond/?utm_medium=referral&utm_source=rss&utm_campaign=headlines,crypto
505,2023-06-15 05:55:00,Hong Kong govt pressures banking giants to accept crypto clients: Report,Cointelegraph,https://cointelegraph.com/news/hong-kong-government-pressures-bank-giants-accept-crypto-clients,crypto
506,2023-06-15 05:40:00,Dow Jones Newswires: China retail sales and industrial production cooled in May,MarketWatch,https://www.marketwatch.com/story/china-s-economic-activity-cooled-in-may-45cde08b,general
507,2023-06-15 05:40:00,Voyager app set to reopen for customer withdrawals as soon as June 20,Cointelegraph,https://cointelegraph.com/news/voyager-app-open-customer-withdrawals-june-20,crypto
508,2023-06-15 05:25:00,AI automation could take over 50% of today’s work activity by 2045: McKinsey,Cointelegraph,https://cointelegraph.com/news/ai-automation-half-work-activities-by-2045-mckinsey,crypto
509,2023-06-15 05:10:00,Hashflow assures users will be made 'whole' following $600K exploit,Cointelegraph,https://cointelegraph.com/news/hashflow-users-made-whole-after-600k-exploit,crypto
510,2023-06-15 05:00:00,FL Entertainment: Banijay to build Media & Entertainment Powerhouse with Balich Wonder Studio,GlobalNewswire,https://www.globenewswire.com/news-release/2023/06/15/2688582/0/en/FL-Entertainment-Banijay-to-build-Media-Entertainment-Powerhouse-with-Balich-Wonder-Studio.html,merger
511,2023-06-15 05:00:00,"SciMed (Asia), Life Science Sales and Service Distributing Subsidiary of PHC Holdings Corporation, Becomes Wholly Owned Subsidiary -- Acquisition Expands PHC Group’s Business Supporting Researchers and Healthcare Providers in Asia-Pacific --",BusinessWire,http://www.businesswire.com/news/home/20230614273132/en/SciMed-Asia-Life-Science-Sales-and-Service-Distributing-Subsidiary-of-PHC-Holdings-Corporation-Becomes-Wholly-Owned-Subsidiary----Acquisition-Expands-PHC-Group%E2%80%99s-Business-Supporting-Researchers-and-Healthcare-Providers-in-Asia-Pacific--,merger
512,2023-06-15 05:00:00,"Japanese Yen Drops After FOMC: Price Setups in USD/JPY, AUD/JPY, GBP/JPY",Dailyfx,https://www.dailyfx.com/news/japanese-yen-drops-after-fomc-price-setups-in-usd-jpy-aud-jpy-gbp-jpy-20230615.html,forex
513,2023-06-15 04:51:38,ECB the main focus on the agenda today,Forexlive,https://www.forexlive.com/news/ecb-the-main-focus-on-the-agenda-today-20230615/,forex
514,2023-06-15 04:50:55,U.S. Justice Department Agrees to Try Sam Bankman-Fried on Original Charges Only for Now,CoinDesk,https://www.coindesk.com/policy/2023/06/15/us-justice-department-agrees-to-try-sam-bankman-fried-on-original-charges-only-for-now/?utm_medium=referral&utm_source=rss&utm_campaign=headlines,crypto
515,2023-06-15 04:43:10,‘Who the hell’ is Prometheum and what did it say to Congress about SEC compliance?,Cointelegraph,https://cointelegraph.com/news/who-is-prometheum-what-testify-congress-about-crypto-sec,crypto
516,2023-06-15 04:17:34,Where will Japan draw a hard line on the yen drop?,Forexlive,https://www.forexlive.com/news/where-will-japan-draw-a-hard-line-on-the-yen-drop-20230615/,forex
517,2023-06-15 03:34:37,Institutional crypto broker FPG halts withdrawals after $20M cyberattack,Cointelegraph,https://cointelegraph.com/news/floating-point-group-fpg-halts-withdrawals-after-cyberattack,crypto
518,2023-06-15 03:30:00,Exploring Technological Innovations in the GCC Waste Management Industry,GlobalNewswire,https://www.globenewswire.com/news-release/2023/06/15/2688575/0/en/Exploring-Technological-Innovations-in-the-GCC-Waste-Management-Industry.html,merger
519,2023-06-15 03:01:00,Dow Jones Newswires: China’s central bank cuts key policy rate for first time in nearly a year,MarketWatch,https://www.marketwatch.com/story/china-s-central-bank-cuts-key-policy-rate-5c3169e7,general
520,2023-06-15 03:00:00,Australian Dollar Steadies on Jobs Data While China Slows. Where to for AUD/USD?,Dailyfx,https://www.dailyfx.com/news/australian-dollar-steadies-on-jobs-data-while-china-slows-where-to-for-aud-usd-20230615.html,forex
